{
  "schema": "fmea-mining.d9-oem-evidence-request.v1",
  "version": "1.3.31",
  "requestId": "OEM-REQ-D9-UNDERCARRIAGE-001",
  "pilotId": "OEM-PILOT-D9-UNDERCARRIAGE",
  "modelId": "EQ07",
  "maturity": "ready_to_send_request_not_sent",
  "sourceOfTruth": "data/quality/oem-d9-evidence-intake.v1.json",
  "relatedBlocker": "BLK-D9-OEM",
  "classification": "public_metadata_only_no_equipment_identifier_or_oem_content",
  "scope": "D9 material rodante: sapatas/elos e fixadores, roletes, roda-guia e tensionamento; comparar conjunto instalado ao arranjo OEM aplicável.",
  "purpose": "Solicitação técnica pronta para encaminhamento a pessoas autorizadas, sem atribuição individual, dado confidencial ou execução fictícia.",
  "requestRouting": {
    "initiatorDiscipline": "engenharia_manutencao",
    "oemLiteratureCustody": "pessoa_com_acesso_licenciado_a_SIS_OEM",
    "assetVerification": "engenharia_ativos",
    "materialsVerification": "materiais_cadastro",
    "sapCustody": "dados_mestres_sap",
    "independentReviewer": "engenharia_mecanica_independente",
    "recipientIdentity": null,
    "authorizedChannel": null,
    "requestSentAt": null,
    "trackingTicket": null
  },
  "gates": [
    {
      "id": "REQ-D9-01",
      "originInputId": "serial-prefix",
      "originSourceStatus": "not_supplied",
      "originRelevance": "efetividade_por_configuracao_D9",
      "evidenceClass": "identification",
      "ownerDiscipline": "engenharia_ativos",
      "requestText": "Solicitar prefixo e número de série completos ou arranjo OEM validado em inventário corporativo; checar placa física com registros autorizados.",
      "originalPrimaryEvidence": "Registro controlado do prefixo e série completos (ou arranjo homologado) do D9 objeto de inspeção",
      "independentCrossCheck": "Confrontar número físico da máquina e registro de fabricante com dados mestres autorizados",
      "acceptanceEvidence": "Registro de identificação do equipamento confirmado por fonte física e base OEM",
      "publicationRestriction": "Dados identificáveis somente em cofre corporativo; nenhuma série deve constar no GitHub.",
      "requested": false,
      "received": false,
      "sourceVerified": false,
      "approved": false,
      "privateEvidenceReference": null,
      "sourceRevision": null,
      "sourceEffectivity": null,
      "applicableSerialOrArrangement": null,
      "reviewerPrimary": null,
      "reviewerIndependent": null,
      "reviewDecision": "pending",
      "evidenceOwnerAssigned": null,
      "corporateDueDate": null
    },
    {
      "id": "REQ-D9-02",
      "originInputId": "oem-omm",
      "originSourceStatus": "not_supplied",
      "originRelevance": "efetividade_por_configuracao_D9",
      "evidenceClass": "oem_manual",
      "ownerDiscipline": "engenharia_mecanica",
      "requestText": "Solicitar referência, número de mídia, revisão e intervalo de série do OMM aplicável via acesso SIS autorizado.",
      "originalPrimaryEvidence": "Número de mídia, revisão, faixa de séries e edição do OMM efetivo pelo SIS",
      "independentCrossCheck": "Confirmar que o manual se aplica à configuração acima antes de usar qualquer valor dimensional",
      "acceptanceEvidence": "Edição/revisão e efetividade por prefixo/arranjo do D9 verificadas",
      "publicationRestriction": "Não solicitar reprodução de manual licenciado no repositório público.",
      "requested": false,
      "received": false,
      "sourceVerified": false,
      "approved": false,
      "privateEvidenceReference": null,
      "sourceRevision": null,
      "sourceEffectivity": null,
      "applicableSerialOrArrangement": null,
      "reviewerPrimary": null,
      "reviewerIndependent": null,
      "reviewDecision": "pending",
      "evidenceOwnerAssigned": null,
      "corporateDueDate": null
    },
    {
      "id": "REQ-D9-03",
      "originInputId": "oem-parts",
      "originSourceStatus": "not_verified",
      "originRelevance": "efetividade_por_configuracao_D9",
      "evidenceClass": "oem_parts_arrangement",
      "ownerDiscipline": "materiais_cadastro",
      "requestText": "Solicitar BOM/desenhos de arranjo para sapatas, elos, fixadores, roletes, roda-guia e tensor; conferir alterações instaladas.",
      "originalPrimaryEvidence": "Desenho/BOM OEM por arranjo para sapatas, fixadores, roda-guia, roletes, correntes e tensionamento",
      "independentCrossCheck": "Confrontar composição instalada e registros de modificações, sem presumir intercambiabilidade",
      "acceptanceEvidence": "Lista de componentes aplicáveis verificada contra o arranjo instalado",
      "publicationRestriction": "Não presumir PN, intercambiabilidade ou composição entre variantes.",
      "requested": false,
      "received": false,
      "sourceVerified": false,
      "approved": false,
      "privateEvidenceReference": null,
      "sourceRevision": null,
      "sourceEffectivity": null,
      "applicableSerialOrArrangement": null,
      "reviewerPrimary": null,
      "reviewerIndependent": null,
      "reviewDecision": "pending",
      "evidenceOwnerAssigned": null,
      "corporateDueDate": null
    },
    {
      "id": "REQ-D9-04",
      "originInputId": "oem-bolting",
      "originSourceStatus": "not_verified",
      "originRelevance": "efetividade_por_configuracao_D9",
      "evidenceClass": "oem_service_procedure",
      "ownerDiscipline": "engenharia_mecanica",
      "requestText": "Solicitar procedimento OEM efetivo para junta sapata–elo, material/PN do fixador, reutilização, condição das superfícies e sequência de aperto.",
      "originalPrimaryEvidence": "Procedimento oficial vigente de junta sapata–elo, fixador autorizado, condição de reutilização e sequência de aperto",
      "independentCrossCheck": "Verificar aplicabilidade por série e revisão independente antes de anotar torque-turn operacional",
      "acceptanceEvidence": "Método e critérios de fixação checados por série/revisão e segundo profissional",
      "publicationRestriction": "Proibido inventar torque, ângulo, reaproveitamento, ferramenta ou sequência.",
      "requested": false,
      "received": false,
      "sourceVerified": false,
      "approved": false,
      "privateEvidenceReference": null,
      "sourceRevision": null,
      "sourceEffectivity": null,
      "applicableSerialOrArrangement": null,
      "reviewerPrimary": null,
      "reviewerIndependent": null,
      "reviewDecision": "pending",
      "evidenceOwnerAssigned": null,
      "corporateDueDate": null
    },
    {
      "id": "REQ-D9-05",
      "originInputId": "oem-cts",
      "originSourceStatus": "not_verified",
      "originRelevance": "efetividade_por_configuracao_D9",
      "evidenceClass": "oem_measurement_method",
      "ownerDiscipline": "inspecao_preditiva",
      "requestText": "Solicitar tabela CTS efetiva para a variante de material rodante, instrumentos/calibração, pontos e orientação de cada medição, critérios de desgaste.",
      "originalPrimaryEvidence": "Padrão CTS autorizado da variante de material rodante, ferramenta e localização de cada medida de desgaste",
      "independentCrossCheck": "Verificar componente, posicionamento e baseline OEM específico antes de qualquer limite numérico",
      "acceptanceEvidence": "Locais, técnica de inspeção e limites de desgaste rastreados à versão OEM aplicável",
      "publicationRestriction": "Proibido inventar dimensões de referência, tolerâncias, limites ou condições de medição.",
      "requested": false,
      "received": false,
      "sourceVerified": false,
      "approved": false,
      "privateEvidenceReference": null,
      "sourceRevision": null,
      "sourceEffectivity": null,
      "applicableSerialOrArrangement": null,
      "reviewerPrimary": null,
      "reviewerIndependent": null,
      "reviewDecision": "pending",
      "evidenceOwnerAssigned": null,
      "corporateDueDate": null
    },
    {
      "id": "REQ-D9-06",
      "originInputId": "sap-master",
      "originSourceStatus": "not_verified",
      "originRelevance": "efetividade_por_configuracao_D9",
      "evidenceClass": "corporate_master_data",
      "ownerDiscipline": "dados_mestres_sap",
      "requestText": "Solicitar relatório privado de equipamento SAP, local funcional, lista técnica, histórico de alterações e relação com configuração OEM.",
      "originalPrimaryEvidence": "Extrato do local funcional, objeto SAP, equipamento, lista técnica e situação de cadastro",
      "independentCrossCheck": "Comparar hierarquia SAP com BOM por série, sem inferir peça a partir do nome de subgrupo",
      "acceptanceEvidence": "Conciliação dos dados mestres SAP com arranjo confirmado, por responsável autorizado",
      "publicationRestriction": "Nenhum local SAP, grupo de avaliação, código de componente ou ordem deve ser inferido do nome.",
      "requested": false,
      "received": false,
      "sourceVerified": false,
      "approved": false,
      "privateEvidenceReference": null,
      "sourceRevision": null,
      "sourceEffectivity": null,
      "applicableSerialOrArrangement": null,
      "reviewerPrimary": null,
      "reviewerIndependent": null,
      "reviewDecision": "pending",
      "evidenceOwnerAssigned": null,
      "corporateDueDate": null
    },
    {
      "id": "REQ-D9-07",
      "originInputId": "field-review",
      "originSourceStatus": "not_performed",
      "originRelevance": "efetividade_por_configuracao_D9",
      "evidenceClass": "technical_field_review",
      "ownerDiscipline": "engenharia_oficina",
      "requestText": "Solicitar revisão posterior da inspeção física e das evidências por engenharia/oficina e um revisor independente; registrar hipóteses concorrentes.",
      "originalPrimaryEvidence": "Parecer documentado de engenharia e oficina/inspeção sobre achados físicos e limites de aplicação",
      "independentCrossCheck": "Exigir revisores independentes, identificação de documentos analisados e separação causa/efeito",